,question,is_correct,num_characters,num_words,num_sentences,transformed_text
3041,"When spelled out, what is the only number whose letters appear in alphabetical order?",0,85,16,1,spell number whose letter appear alphabet order
3044,The titles of most Sherlock Holmes stories begin with what three words?,0,71,13,1,titl sherlock holm stori begin three word
3047,"By definition, aleatoric music is considered to be what?",1,56,11,1,definit aleator music consid
3050,Which of these iconic mountains sits at the southernmost latitude?,1,66,11,1,icon mountain sit southernmost latitud
3053,A famous 1977 FBI sting to unmask KGB operatives had what curious name?,0,71,14,1,famou 1977 fbi sting unmask kgb oper curiou name
3056,Which singer does NOT have a star on the Hollywood Walk of Fame?,0,64,14,1,singer star hollywood walk fame
3059,Which of these classic novels has the longest first sentence?,1,61,11,1,classic novel longest first sentenc
3062,What are pocket calculators traditionally used for?,1,51,8,1,pocket calcul tradit use
3065,Which of the following is a US state?,1,37,9,1,follow us state
3068,Which of these is designed to make easily erasable marks?,0,57,11,1,design make easili eras mark
3071,"When in flight, what letter of the alphabet do migrating geese most commonly form?",0,82,16,1,flight letter alphabet migrat gees commonli form
3074,Which of these is the name of a real chemical element?,0,54,12,1,name real chemic element
3077,Who has NOT hosted an edition of the science miniseries “Cosmos”?,0,65,14,1,host edit scienc miniseri cosmo
3080,What old-fashioned musical instrument shares its name with a Greek muse?,1,72,12,1,music instrument share name greek muse
3083,Which profession would normally use a Bristol board?,0,52,9,1,profess would normal use bristol board
3086,Which of these synonyms for “small amount” comes from a Japanese word?,1,70,15,1,synonym small amount come japanes word
3089,"When England had no monarch during the 17th century, the ruler held what title?",1,79,16,1,england monarch 17th centuri ruler held titl
3092,Which of these Super Mario trademarks was featured in the 1983 arcade game “Mario Bros.”?,0,89,18,1,super mario trademark featur 1983 arcad game mario
3094,"In Canada's national anthem, what word is used to describe Canadian hearts?",0,75,15,1,canada nation anthem word use describ canadian heart
3097,White precipitation that falls from the sky is called what?,0,59,11,1,white precipit fall sky call
3100,"In anatomy, different parts of an organism are often separated by what?",0,71,14,1,anatomi differ part organ often separ
3103,"In political elections, someone who is currently in office is known as what?",1,76,15,1,polit elect someon current offic known
3106,"By definition, whole-body cryotherapy traditionally involves what?",1,66,9,1,definit cryotherapi tradit involv
3108,Which of these materials is most commonly used as a plant fertilizer?,0,69,13,1,materi commonli use plant fertil
3111,What word refers to 128 cubic feet of firewood?,1,47,10,1,word refer 128 cubic feet firewood
3114,A late 19th-century essay introduced the concept of brunch as a way to address what?,0,84,16,1,late essay introduc concept brunch way address
3117,The world’s premier cheese-rolling festival features what kind of cheese?,1,73,13,1,world premier festiv featur kind chees
3119,"When read as a Roman numeral, which president’s middle initial has a value of 1000?",0,83,19,1,read roman numer presid middl initi valu 1000
3122,The Lil Wayne hit “6 Foot 7 Foot” samples a song prominently featured in which Tim Burton film?,1,95,21,1,lil wayn hit 6 foot 7 foot sampl song promin featur tim burton film
3125,Which of these is a real title from the “Mr. Men” book series?,0,62,17,2,real titl mr men book seri
3128,Which of these bands did NOT play at the inaugural Coachella festival?,0,70,13,1,band play inaugur coachella festiv
3131,Which of these is a common circus act?,0,38,9,1,common circu act
3134,What character appears on stickers that warn children of poisons?,0,65,11,1,charact appear sticker warn children poison
3137,What color is in the middle of most three-color traffic lights?,1,63,12,1,color middl traffic light
3140,What is the official language of Brazil?,0,40,8,1,offici languag brazil
3143,Which of the following pastas literally translates to “little ears”?,0,68,13,1,follow pasta liter translat littl ear
3146,What are the scientists on “The Muppet Show” named for?,1,55,13,1,scientist muppet show name
3149,What shape are the faces of an octahedron?,0,42,9,1,shape face octahedron
3152,Which is NOT the name of a Marx Brother?,0,40,10,1,name marx brother
3155,"When put side by side, which two state postal abbreviations form a postal word?",0,79,16,1,put side side two state postal abbrevi form postal word
3157,Which US state's capital lies at the highest altitude?,0,54,11,1,us state capit lie highest altitud
3160,What did Mr. Potato Head give to C. Everett Koop at a 1980s press event?,0,72,17,2,potato head give everett koop 1980 press event
3163,Which UK country has a NON-mythical national animal?,1,52,9,1,uk countri nation anim
3166,Which of these is the name of an island in Hawaii?,0,50,12,1,name island hawaii
3169,"In a humorous saying for British nobility, the second-born child is known as the what?",0,86,17,1,humor say british nobil child known
3172,Which of these clothing items is specifically worn to handle cold weather?,1,74,13,1,cloth item specif worn handl cold weather
3175,"Thanks to an old process for quick copying, architectural plans are traditionally what color?",0,93,16,1,thank old process quick copi architectur plan tradit color
3178,Which popular game uses a doubling cube?,0,40,8,1,popular game use doubl cube
3181,Which word is spelled the same way in the United States and the United Kingdom?,1,79,16,1,word spell way unit state unit kingdom
3184,"During World War I, what dog breed was widely renamed “liberty hound” in the US?",0,80,19,1,world war dog breed wide renam liberti hound us
3187,Which of these is a required exam at Harry Potter's Hogwarts school?,1,68,14,1,requir exam harri potter hogwart school
3190,The earliest known human writing occurred near what river?,1,58,10,1,earliest known human write occur near river
3193,"In Dr. Seuss’s “The Cat in the Hat Comes Back,” what is inside the Cat’s hat?",1,77,24,1,seuss cat hat come back insid cat hat
3195,Which pair of nations has units of currency with the same name?,0,63,13,1,pair nation unit currenc name
3198,Which has NOT been the name of an Android operating system?,0,59,12,1,name android oper system
3201,What do candles on a birthday cake traditionally represent?,0,59,10,1,candl birthday cake tradit repres
3204,Which of these Georges was a US president?,1,42,9,1,georg us presid
3207,The biggest lake in the US borders which of these states?,0,57,12,1,biggest lake us border state
3210,What land animal holds the Guinness World Record for the largest mouth?,1,71,13,1,land anim hold guin world record largest mouth
3213,Where is the largest sawgrass prairie in North America?,0,55,10,1,largest sawgrass prairi north america
3216,Which of these scientists is credited as the first to give her subjects names instead of numbers?,0,97,18,1,scientist credit first give subject name instead number
3217,Which of these best describes the symbol for “NOT” in American Sign Language?,0,77,16,1,best describ symbol american sign languag
3219,"Measured by magnitude, the largest recorded earthquake in US history hit what city hardest?",0,91,16,1,measur magnitud largest record earthquak us histori hit citi hardest
3221,Which of these is NOT a word in the gene-editing acronym CRISPR?,0,64,13,1,word acronym crispr
3224,Koko the gorilla is famous for doing which of these things?,0,59,12,1,koko gorilla famou thing
3227,"In the original “Rampage” arcade game, which monster’s face is NOT featured on the title screen?",1,96,22,1,origin rampag arcad game monster face featur titl screen
3230,"According to ancient Rome’s iconic epic, what hero was hidden inside the Trojan Horse?",0,86,18,1,accord ancient rome icon epic hero hidden insid trojan hors
3233,Which of these synonyms for “big” traces its roots to the biggest country on Earth?,0,83,18,1,synonym big trace root biggest countri earth
3236,"In a popular saying, “a picture is worth a thousand” what?",0,58,15,1,popular say pictur worth thousand
3239,Which of these is one of the five standard human senses?,1,56,12,1,one five standard human sens
3242,A 2002 law requires US candidates to say which of these phrases in political ads?,1,81,16,1,2002 law requir us candid say phrase polit ad
3244,What is the proper name for a maker of barrels?,1,47,11,1,proper name maker barrel
3247,Passing a soccer ball through an opponent’s legs is known as a what?,0,68,16,1,pass soccer ball oppon leg known
3250,Which of these major cities is NOT a state capital?,0,51,11,1,major citi state capit
3253,Rockstar Games has produced two video games based on which film franchise?,0,74,13,1,rockstar game produc two video game base film franchis
3256,The first beta blocker was developed to treat what ailment?,0,59,11,1,first beta blocker develop treat ailment
3259,The reality show “Strange Love” starred a founding member of what hip-hop act?,0,78,16,1,realiti show strang love star found member act
3262,A bull terrier honored by the military after World War I later became what university’s mascot?,0,95,19,1,bull terrier honor militari world war later becam univers mascot
3264,Theo and Noah are the names of what animals gifted to the pope for Christmas 2014?,1,82,17,1,theo noah name anim gift pope christma 2014
3267,Which of these songs does NOT have the same melody as the other two?,0,68,15,1,song melodi two
3270,What does the small hand on a clock typically indicate?,1,55,11,1,small hand clock typic indic
3273,What are French fries usually made out of?,1,42,9,1,french fri usual made
3276,Which of these is a common breed of cat?,1,40,10,1,common breed cat
3279,"In construction, steel rods that are used to reinforce concrete are called what?",1,80,15,1,construct steel rod use reinforc concret call
3282,"By definition, where are people known as Turkmen from?",1,54,11,1,definit peopl known turkmen
3285,Our solar system’s main asteroid belt lies between the orbits of which two planets?,0,83,17,1,solar system main asteroid belt lie orbit two planet
3287,What is the name of the company behind the classic “Doom” and “Quake” computer games?,1,85,20,1,name compani behind classic doom quak comput game
3290,Which of these US presidents was NEVER impeached?,1,49,9,1,us presid never impeach
3293,Dr. Charles Drew’s greatest contribution to medicine was in what area?,0,70,14,1,charl drew greatest contribut medicin area
3296,Which of these animals is NOT known to have passed the mirror self-recognition test?,0,84,15,1,anim known pass mirror test
3299,Which is both a type of subatomic quark particle and a Motorola smartphone?,0,75,14,1,type subatom quark particl motorola smartphon
3302,The world's largest living single-stem tree is named for a soldier who fought where?,1,84,16,1,world largest live tree name soldier fought
3304,"According to the old saying, “actions speak louder than” what?",1,62,14,1,accord old say action speak louder
3307,The author Bram Stoker created what famous vampire in 1897?,1,59,11,1,author bram stoker creat famou vampir 1897
3310,Which of these cinnamons is typically found at the supermarket?,0,63,11,1,cinnamon typic found supermarket
3313,“Le Monde” is a daily newspaper based in what capital city?,0,59,14,1,le mond daili newspap base capit citi
3316,Which of these words refers to a part of a bird’s stomach that grinds food?,1,75,18,1,word refer part bird stomach grind food
3319,What classic game features a piece called a spinner?,0,52,10,1,classic game featur piec call spinner
3322,A famous Emily Dickinson poem compared which of these phenomena to a bee?,0,73,14,1,famou emili dickinson poem compar phenomena bee
3325,The DARPA project “FastRunner” is a robot whose design resembles what speedy animal?,0,84,16,1,darpa project fastrunn robot whose design resembl speedi anim
3328,Which of these culinary terms is also the name of an active volcano?,0,68,14,1,culinari term also name activ volcano
3331,Which of these hit ’80s songs is NOT by a band whose name is a continent?,0,73,18,1,hit 80 song band whose name contin
3334,Which candy company’s name was formed from its founder’s name and home city?,0,76,18,1,candi compani name form founder name home citi
3337,Which of these ’80s films has the greatest age gap between its romantic leads?,1,78,16,1,80 film greatest age gap romant lead
3340,What does a thermometer primarily measure?,0,42,7,1,thermomet primarili measur
3343,What common term means a prying or interfering person?,0,54,10,1,common term mean pri interf person
3346,The term “blog” is short for what?,0,34,10,1,term blog short
3349,Which of these animals is a crustacean?,1,39,8,1,anim crustacean
3352,An actor who speaks directly to the camera or audience is said to be breaking what?,0,83,17,1,actor speak directli camera audienc said break
3354,What is the island containing Haiti and the Dominican Republic called?,0,70,12,1,island contain haiti dominican republ call
3357,Which of these is an actual Nobel Prize category?,1,49,10,1,actual nobel prize categori
3360,What is the name of George RR Martin’s best-selling fantasy novel series?,1,73,15,1,name georg rr martin fantasi novel seri
3362,"For the US 50 State Quarters Program, Ohio and North Carolina argued over the rights to a famous what?",1,102,21,1,us 50 state quarter program ohio north carolina argu right famou
3365,"Including today, how many “Friday the 13ths” will occur during 2018?",1,68,15,1,includ today mani friday 13th occur 2018
3368,Which of these is a bone in the human body AND a geometric form?,0,64,15,1,bone human bodi geometr form
3371,Which of these mountain peaks does NOT get its name from a color?,1,65,14,1,mountain peak get name color
3374,What playwright wrote “Macbeth”?,0,32,7,1,playwright wrote macbeth
3377,What device is used to amplify sound?,0,37,8,1,devic use amplifi sound
3380,What sport usually has higher numbers in the final score than the other two?,0,76,15,1,sport usual higher number final score two
3383,“The Landlord’s Game” by Elizabeth Magie evolved into what classic board game?,1,78,17,1,landlord game elizabeth magi evolv classic board game
3386,What chemical element was observed on the Sun before it was discovered on Earth?,1,80,15,1,chemic element observ sun discov earth
3389,Which Ivy League school is by far the most recently founded?,1,60,12,1,ivi leagu school far recent found
3392,What is the literal translation of the pope’s Twitter handle?,0,61,13,1,liter translat pope twitter handl
3395,Which of these orders of insects has the largest number of species?,1,67,13,1,order insect largest number speci
3398,What nation’s population lives mainly on islands locally known as “North Island” and “South Island”?,0,100,22,1,nation popul live mainli island local known north island south island
3399,What was noteworthy about the world depicted in Edwin Abbott’s classic novel “Flatland”?,0,88,18,1,noteworthi world depict edwin abbott classic novel flatland
3401,Which is the INCORRECT pairing of actress to “Golden Girl”?,0,59,13,1,incorrect pair actress golden girl
3404,The only Super Bowl halftime show broadcast in 3D had what theme?,1,65,13,1,super bowl halftim show broadcast 3d theme
3406,Which of these is one of the four cardinal directions on a compass?,0,67,14,1,one four cardin direct compass
3409,A popular card game involves telling your opponent to do what?,0,62,12,1,popular card game involv tell oppon
3412,"By area, which of these US states is biggest?",1,45,11,1,area us state biggest
3415,Surviving the Titanic earned Molly Brown what nickname?,0,55,9,1,surviv titan earn molli brown nicknam
3418,Which of the following is NOT made from natural fibers?,1,55,11,1,follow made natur fiber
3421,"In meteorology, okta units measure which of these things?",0,57,11,1,meteorolog okta unit measur thing
3424,Which US federal tax return form is known as the “short” one?,0,61,15,1,us feder tax return form known short one
3427,Which of the following countries sets speed limits in miles per hour?,0,69,13,1,follow countri set speed limit mile per hour
3430,Which of these enlightenment philosophers also wrote a ridiculously steamy novel?,0,81,12,1,enlighten philosoph also wrote ridicul steami novel
3433,A founder of publishing house Simon &amp; Schuster is the parent of a famous what?,0,82,18,1,founder publish hous simon amp schuster parent famou
3436,Which of these entrepreneurs has the most followers on Instagram?,1,65,11,1,entrepreneur follow instagram
3439,Which of these singers has an eponymous album title?,1,52,10,1,singer eponym album titl
3442,Which of these is a common type of building?,1,44,10,1,common type build
3445,"Typically, what kind of sauce is on a cheese pizza?",0,51,12,1,typic kind sauc chees pizza
3448,Which of these words is also a common term in arithmetic?,0,57,12,1,word also common term arithmet
3451,Which of these is a real zodiac sign?,0,37,9,1,real zodiac sign
3454,Which Reese Witherspoon movie has gotten a Broadway musical adaptation?,0,71,11,1,rees witherspoon movi gotten broadway music adapt
3457,"As quoted on a US gov’t website, who said that income tax is “the hardest thing in the world to understand”?",0,108,27,1,quot us gov websit said incom tax hardest thing world understand
3458,The name of a facility for mentally ill foes of Batman is taken from a story by what author?,0,92,20,1,name facil mental ill foe batman taken stori author
3461,A 2017 hack of the “Harvard Crimson” front page made fun of what celebrity?,0,75,17,1,2017 hack harvard crimson front page made fun celebr
3464,Which of these insects is typically the heaviest by far?,0,56,11,1,insect typic heaviest far
3467,Which gulf is NOT located at the northern end of the Red Sea?,1,61,14,1,gulf locat northern end red sea
3470,Who was appointed to the US Senate despite being too young to legally serve?,1,76,15,1,appoint us senat despit young legal serv
3473,The first streaming-only album to win a Grammy takes its title from a kind of what?,0,83,17,1,first album win grammi take titl kind
3475,Soup is typically eaten with what kind of kitchen utensil?,0,58,11,1,soup typic eaten kind kitchen utensil
3478,The Earth is covered in about 70 percent what?,0,46,10,1,earth cover 70 percent
3481,The warning that police give arrested suspects are known as what “rights”?,0,74,15,1,warn polic give arrest suspect known right
3484,"In writing, what set of rules regulates the order of words?",0,59,13,1,write set rule regul order word
3487,What landmark did Ronald Reagan famously tell Mikhail Gorbachev to tear down?,0,77,13,1,landmark ronald reagan famous tell mikhail gorbachev tear
3489,Which of these singers referred to himself as “the Lizard King”?,0,64,14,1,singer refer lizard king
3492,What is the nickname of the NHL player with the record for most games ever played?,0,82,17,1,nicknam nhl player record game ever play
3495,"When referring to cameras, which of these words is part of the acronym DSLR?",0,76,16,1,refer camera word part acronym dslr
3498,"Before “This American Life,” Ira Glass was the co-host of an NPR show based in what city?",1,89,21,1,american life ira glass npr show base citi
3501,Which of these actors does NOT have their own brand of wine?,0,60,13,1,actor brand wine
3504,Which game was created by the same mind behind RoboRally?,1,57,11,1,game creat mind behind robor
3507,Which of these fashion designers once lost his job because the clothes he designed were too grunge?,0,99,18,1,fashion design lost job cloth design grung
3508,"According to Kermit the Frog, “It’s not easy being” what?",1,57,16,1,accord kermit frog easi
3511,What is the largest planet in our solar system?,1,47,10,1,largest planet solar system
3514,What computational device predates pocket calculators by thousands of years?,0,76,11,1,comput devic predat pocket calcul thousand year
3517,The tiny country of Liechtenstein borders what two nations?,0,59,10,1,tini countri liechtenstein border two nation
3520,"What does “brimstone,” as mentioned in the Bible, refer to?",0,59,15,1,brimston mention bibl refer
3523,"Along with California, what state was the first to pass a medical marijuana proposition?",0,88,16,1,along california state first pass medic marijuana proposit
3526,"According to its inventor, the graphics format spelled G-I-F is pronounced how?",0,79,14,1,accord inventor graphic format spell pronounc
3529,“Here Comes the Bride” was written by the composer of which opera?,0,66,15,1,come bride written compos opera
3532,The “Back to the Future” movie trilogy spans how long a period of time?,1,71,17,1,back futur movi trilog span long period time
3535,Which of these dishes would most likely NOT be served at Buckingham Palace?,0,75,14,1,dish would like serv buckingham palac
3538,Which is a component of most modern computers?,1,46,9,1,compon modern comput
3541,Uprooted thistle plants that are driven about by the wind are known as what?,0,76,15,1,uproot thistl plant driven wind known
3544,What internet term is named for a mythical creature?,0,52,10,1,internet term name mythic creatur
3547,Fancy Scotch whisky is often described as “single” what?,0,56,12,1,fanci scotch whiski often describ singl
3550,What does the “S” stand for in the government agency TSA?,0,57,14,1,stand govern agenc tsa
3553,"According to the creator, which of these classic characters is actually NOT a cat?",0,82,16,1,accord creator classic charact actual cat
3556,In what language is “555” internet slang for laughter?,1,54,12,1,languag 555 internet slang laughter
3559,Which of these actors is famous for the classic movie line “I'm walkin’ here!”?,0,79,20,1,actor famou classic movi line walkin
3562,The invention known as the Archimedes’ screw is typically used for what?,1,72,14,1,invent known archimed screw typic use
3565,In which discipline are you most likely to learn about morphemes?,0,65,12,1,disciplin like learn morphem
3568,"When ranking the seven continents by population, which is in the exact middle?",0,78,15,1,rank seven contin popul exact middl
3571,Which show did NOT feature a main cast member who played one of Jerry’s girlfriends on “Seinfeld”?,0,98,22,1,show featur main cast member play one jerri girlfriend seinfeld
3574,What kind of power do televisions run on?,1,41,9,1,kind power televis run
3577,Which of these awards is given to the NBA’s best first-year player?,0,67,15,1,award given nba best player
3580,Which of these Beatles songs is sung entirely in English?,1,57,11,1,beatl song sung entir english
3583,"Of the following cities, which is farthest west?",0,48,10,1,follow citi farthest west
3586,What singer shares a name with a bygone empire headquartered in Ghana?,0,70,13,1,singer share name bygon empir headquart ghana
3589,Which of these battles did NOT happen during World War II?,1,58,12,1,battl happen world war ii
3592,What PBS icon was named an honorary captain of a National Hockey League team?,1,77,15,1,pb icon name honorari captain nation hockey leagu team
3595,The so-called “Billionaire Boys Club” of the 1980s got rich quick through what?,0,79,16,1,billionair boy club 1980 got rich quick
3598,Which of these nations has NOT produced a secretary-general of the United Nations?,1,82,14,1,nation produc unit nation
3601,"Where was Richard Nixon speaking when he famously declared, “I am not a crook”?",0,79,18,1,richard nixon speak famous declar crook
3604,“Dirty water dog” is a New York City nickname for what edible street food?,0,74,17,1,dirti water dog new york citi nicknam edibl street food
3607,A house in need of repairs and remodeling is known as what?,0,59,13,1,hous need repair remodel known
3610,A police officer can search your house without a warrant if they have what cause?,0,81,16,1,polic offic search hous without warrant caus
3613,The tech term “malware” combines what word with software?,1,57,12,1,tech term malwar combin word softwar
3616,"In “The Silence of the Lambs,” Hannibal Lecter paired his fava beans with a wine from what country?",0,99,22,1,silenc lamb hannib lecter pair fava bean wine countri
3619,Which of these synonyms for “large” was coined most recently?,0,61,13,1,synonym larg coin recent
3622,"According to the author of “Harry Potter,” where is Hogwarts?",0,61,14,1,accord author harri potter hogwart
3625,Legendary NBA player Larry Bird went on to coach what team?,0,59,12,1,legendari nba player larri bird went coach team
3628,Which of these US states’ capitals has the fewest residents?,1,60,12,1,us state capit fewest resid
3631,Which of these rappers is the tallest?,1,38,8,1,rapper tallest
3634,What kind of tax does NOT apply in the regular edition of Monopoly?,1,67,14,1,kind tax appli regular edit monopoli
3637,The heroine of Disney’s “The Little Mermaid” was based on a star of what classic sitcom?,1,88,21,1,heroin disney littl mermaid base star classic sitcom
3639,"When the US dollar currency was created, what was its value pegged to?",0,70,15,1,us dollar currenc creat valu peg
3642,Which of these major ancient cities was located the farthest north?,0,67,12,1,major ancient citi locat farthest north
3645,Which person is NOT mentioned in REM’s “It’s the End of the World as We Know It”?,1,81,24,1,person mention rem end world know
3648,Which of these sandwiches is often grilled?,1,43,8,1,sandwich often grill
3651,What is the term for illegally crossing the street while not at a crosswalk?,0,76,15,1,term illeg cross street crosswalk
