,question,is_correct,num_characters,num_words,num_sentences,transformed_text
0,What did Yankee Doodle stick in his cap?,1,40,9,1,yanke doodl stick cap
3,What word completes the phrase: “Everything but the kitchen”?,1,61,13,1,word complet phrase everyth kitchen
6,What was the first theatrical feature film to be completely computer-animated?,0,78,12,1,first theatric featur film complet
9,"Traditionally, an “amuse-bouche” arrives right before what part of the meal?",1,76,15,1,tradit arriv right part meal
12,"In the game of Candy Land, which player goes first?",1,51,12,1,game candi land player goe first
15,"In the popular comic strip, what color is Hagar the Horrible’s beard?",0,69,16,1,popular comic strip color hagar horribl beard
18,What spice comes from the crocus flower?,0,40,8,1,spice come crocu flower
21,Albert Einstein won a Nobel Prize for his work on what scientific phenomenon?,0,77,14,1,albert einstein nobel prize work scientif phenomenon
23,Buying a can of soda will incur a higher tax in which city?,0,59,14,1,buy soda incur higher tax citi
26,Who is credited with coining the phrase: “For whom the bell tolls”?,1,67,16,1,credit coin phrase bell toll
29,What was the first product to have its barcode scanned at purchase?,0,67,13,1,first product barcod scan purchas
32,Catherine de’ Medici was present at the performance of the first-ever formal what?,0,82,15,1,catherin de medici present perform formal
35,Parmesan cheese is named for an Italian province called what?,0,61,11,1,parmesan chees name italian provinc call
38,Which of these famous fictional animals is a ruminant?,1,54,10,1,famou fiction anim rumin
41,Which popular root beer brand typically contains caffeine?,1,58,9,1,popular root beer brand typic contain caffein
44,Which of these elements would earn you the highest score in Scrabble?,1,69,13,1,element would earn highest score scrabbl
47,What is the correct spelling of the Pennsylvania town famous for its groundhog?,0,79,14,1,correct spell pennsylvania town famou groundhog
50,"In 1973, Arabella and Anita became the first members of what species to go into space?",1,86,18,1,1973 arabella anita becam first member speci go space
53,What was the least popular papal name of the 19th century?,0,58,12,1,least popular papal name 19th centuri
56,New Mexico exempts which group of people from paying state income taxes?,0,72,13,1,new mexico exempt group peopl pay state incom tax
59,Which of these Summer Olympics events uses the longest playing surface?,1,71,12,1,summer olymp event use longest play surfac
62,The college degree “B.A.” is short for what?,1,44,11,1,colleg degre short
65,Which country is part of North America?,0,39,8,1,countri part north america
68,Which tool is typically used to clear a clogged pipe?,0,53,11,1,tool typic use clear clog pipe
71,Which of the original Monopoly game pieces was retired last year?,1,65,12,1,origin monopoli game piec retir last year
74,Which film director holds a U.S. patent for a T-shirt?,0,54,11,1,film director hold patent
77,Which food is traditionally a main ingredient in mock turtle soup?,1,66,12,1,food tradit main ingredi mock turtl soup
80,Aerosmith’s “Dude (Looks Like a Lady)” was written about what heavy metal vocalist?,0,83,20,1,aerosmith dude look like ladi written heavi metal vocalist
83,Which of these is Venus visibly lacking in Botticelli's “Birth of Venus”?,0,73,16,1,venu visibl lack botticelli birth venu
86,Boston and Buffalo have both been home to major pro sports teams named what?,0,76,15,1,boston buffalo home major pro sport team name
89,Which type of animal has been kept as a White House pet by a U.S. president?,1,76,17,1,type anim kept white hous pet presid
92,"In the 1800s, a chemistry student making synthetic quinine accidentally created what dye?",1,89,15,1,1800 chemistri student make synthet quinin accident creat dye
95,Tic-tac-toe is typically played by writing what two symbols?,0,60,10,1,typic play write two symbol
98,What’s the anatomical name for the center of a hurricane?,0,57,13,1,anatom name center hurrican
101,Which of these is an actual Winter Olympics event?,1,50,10,1,actual winter olymp event
104,A high-tech store with no cashiers recently opened in Seattle under what name?,1,78,14,1,store cashier recent open seattl name
107,"By definition, which of these people is guilty of treason?",0,58,12,1,definit peopl guilti treason
110,Which of these actors turned down the role of Frasier Crane?,0,60,12,1,actor turn role frasier crane
113,The Benihana company has a restaurant in which of these places?,0,63,12,1,benihana compani restaur place
116,Which has been the last name of a U.S. president AND a British prime minister?,0,78,16,1,last name presid british prime minist
119,What author has the most books in Modern Library’s 100 Best Novels of the 20th Century?,0,87,19,1,author book modern librari 100 best novel 20th centuri
121,In what medium was Superman’s Kryptonite weakness introduced?,1,61,11,1,medium superman kryptonit weak introduc
124,Which statement is NOT true about photosynthesis and chemosynthesis?,1,68,10,1,statement true photosynthesi chemosynthesi
126,What costume was worn by the original lead singer of the Village People?,0,72,14,1,costum worn origin lead singer villag peopl
129,A spork is a utensil that combines what two things?,0,51,11,1,spork utensil combin two thing
132,"On a compass, what does the letter N typically stand for?",0,57,13,1,compass letter n typic stand
135,"In 2017, what did Twitter do to its 140-character limit on tweets?",1,66,14,1,2017 twitter limit tweet
138,What popular corn chip loosely translates to “little golden things” in Spanish?,0,79,15,1,popular corn chip loos translat littl golden thing spanish
141,U.S. air traffic controllers refer to the plane the Pope travels on by what official call sign?,1,95,18,1,air traffic control refer plane pope travel offici call sign
144,What zodiac sign features a creature that defends itself with an aculeus?,0,73,13,1,zodiac sign featur creatur defend aculeu
147,Who was the first U.S. president to enjoy indoor plumbing at the White House?,0,77,15,1,first presid enjoy indoor plumb white hous
150,"From 2000 to 2002, what MLB team's stadium was named for a company that no longer exists?",0,89,20,1,2000 2002 mlb team stadium name compani longer exist
153,The lunar module for the Apollo 10 moon mission was nicknamed what?,0,67,13,1,lunar modul apollo 10 moon mission nicknam
156,Which public radio program is hosted by the cousin of a multiple Oscar-nominated composer?,1,90,15,1,public radio program host cousin multipl compos
157,"After Prince Edward Island, what is Canada’s most densely populated province?",0,77,15,1,princ edward island canada dens popul provinc
160,An extremely impolite guest at a Nixon family wedding went on to write under what nom de plume?,0,95,19,1,extrem impolit guest nixon famili wed went write nom de plume
162,What is a common remedy for dehydration?,1,40,8,1,common remedi dehydr
165,"The band that recorded “September” is named “Earth, Wind &amp;” what?",0,69,19,1,band record septemb name earth wind amp
168,"In the classic fairy tale, who is Little Red Riding Hood's enemy?",0,65,15,1,classic fairi tale littl red ride hood enemi
171,Pantene Pro-V and Garnier Fructis are popular types of what?,0,60,11,1,panten garnier fructi popular type
174,A bed that folds up into the wall is commonly known as what?,0,60,14,1,bed fold wall commonli known
177,Which of these colleges does NOT have a physical location?,1,58,11,1,colleg physic locat
180,Which of these desserts is often made with ladyfingers?,1,55,10,1,dessert often made ladyfing
183,Which of these is a real illness that affects rabbits?,0,54,11,1,real ill affect rabbit
186,The Doors are named after a famous essay by the author of what iconic novel?,0,76,16,1,door name famou essay author icon novel
189,Which TV news host once wrote about his first date with Monica Lewinsky?,1,72,14,1,tv news host wrote first date monica lewinski
192,The famous German phrase “Sturm und Drang” comes from what?,0,59,13,1,famou german phrase sturm und drang come
195,In which African country is English NOT the official language?,0,62,11,1,african countri english offici languag
198,Which ‘90s movie is an anagram of the original book title which the film is based on?,0,85,19,1,90 movi anagram origin book titl film base
201,Which legendary music producer is closely related to former President Jimmy Carter?,0,83,13,1,legendari music produc close relat former presid jimmi carter
204,"Which of these websites is an online database for movies, television and video games?",0,85,16,1,websit onlin databas movi televis video game
207,What does bicameral mean?,0,25,5,1,bicamer mean
210,A galleon is an old-fashioned type of what?,1,43,9,1,galleon type
213,"What male singing voice type is higher than a bass, but lower than a tenor?",1,75,17,1,male sing voic type higher bass lower tenor
216,Which of these is NOT a real berry?,0,35,9,1,real berri
219,George Washington Carver is famous for his scientific work on what subject?,1,75,13,1,georg washington carver famou scientif work subject
222,Which of these is NOT believed to be a function of the uvula?,1,61,14,1,believ function uvula
225,Which of these baseball legends was a first-ballot Hall of Famer?,0,65,12,1,basebal legend hall famer
228,Which of these things can be mathematically described as an oblate spheroid?,0,76,13,1,thing mathemat describ oblat spheroid
231,“Fro-yo” is short for what?,0,27,8,1,short
234,"In Shakespeare's play “Julius Caesar,” what phrase does the titular character say to Brutus?",1,92,19,1,shakespear play juliu caesar phrase titular charact say brutu
236,What is the name of a Japanese art form that features trees grown in containers?,0,80,16,1,name japanes art form featur tree grown contain
239,What college football team’s chant is also likely to be heard on a farm?,1,72,17,1,colleg footbal team chant also like heard farm
242,What legendary “Buffalo Bill’s Wild West” star had a negative-sounding nickname?,0,80,16,1,legendari buffalo bill wild west star nicknam
245,Where did Bernese Mountain Dogs originate?,0,42,7,1,bernes mountain dog origin
248,Which fashion designer is grandmother to a literal princess?,1,60,10,1,fashion design grandmoth liter princess
251,Which film features the same kind of talking animal as the Old Testament book Numbers?,0,86,16,1,film featur kind talk anim old testament book number
254,Which of these posts was Constance Baker Motley NOT the first African-American woman to hold?,0,93,16,1,post constanc baker motley first woman hold
256,In which country is GeoCities still up and running?,0,51,10,1,countri geociti still run
259,"Before the lyrics are sung, how many finger snaps are heard in the “Addams Family” theme song?",1,94,21,1,lyric sung mani finger snap heard addam famili theme song
262,Which of these is the name of a princess in Disney's “Frozen”?,0,62,16,1,name princess disney frozen
265,The Olympic logo features what combination of shapes?,0,53,9,1,olymp logo featur combin shape
268,The Italian cooking term “al dente” means what?,1,47,11,1,italian cook term al dent mean
271,Which of these companies offers a “freemium” service?,1,53,11,1,compani offer freemium servic
274,What word does Nestlé use to describe their Toll House chocolate chips?,1,71,13,1,word nestlé use describ toll hous chocol chip
277,Which of these countries legally guarantees its citizens “freedom to roam”?,0,75,14,1,countri legal guarante citizen freedom roam
280,Bill Cunningham was a key influence in what style of photography?,0,65,12,1,bill cunningham key influenc style photographi
283,“INTJ” is a personality type based on a hypothesis by which psychiatrist?,0,73,15,1,intj person type base hypothesi psychiatrist
286,Which of these activists is the subject of a song by John Lennon and Yoko Ono?,1,78,17,1,activist subject song john lennon yoko ono
289,The U.S. flag bearer for the 2018 Olympics is a medalist in what event?,0,71,15,1,flag bearer 2018 olymp medalist event
292,Which of these people was born with the same name as a famous ketchup?,0,70,15,1,peopl born name famou ketchup
295,What form of energy do batteries provide?,0,41,8,1,form energi batteri provid
298,Which “Rose” was the lead singer of Guns N' Roses?,0,50,14,1,rose lead singer gun n rose
301,"In a best-selling Little Golden Book, who was “The Monster at The End of This Book”?",1,84,20,1,littl golden book monster end book
304,“Embarazada” is the Spanish word for what?,0,42,10,1,embarazada spanish word
307,Which American car manufacturer first introduced seat belts?,0,60,9,1,american car manufactur first introduc seat belt
310,Which of these authors has NOT written a comic book about Black Panther?,0,72,14,1,author written comic book black panther
313,"Last year, Microsoft angered customers by announcing it would eliminate what Windows software?",0,94,15,1,last year microsoft anger custom announc would elimin window softwar
316,A 1984 Devo album has the same name as a massive 1984 single by what band?,0,74,17,1,1984 devo album name massiv 1984 singl band
319,"In da Vinci’s “Last Supper,” which disciple is depicted holding a weapon?",1,73,18,1,da vinci last supper discipl depict hold weapon
322,Which term is shorthand for a useful item when changing a flat tire?,0,68,14,1,term shorthand use item chang flat tire
325,Tonga's 2016 Olympic flag bearer became a global viral sensation for dressing how?,1,82,15,1,tonga 2016 olymp flag bearer becam global viral sensat dress
327,What Olympic legend was the subject of a song in an Oscar-nominated 1999 film?,1,78,15,1,olymp legend subject song 1999 film
330,Which of these items would be measured on the Scoville scale?,1,61,12,1,item would measur scovil scale
333,Which of these iconic African-American leaders was NOT born into slavery?,1,73,12,1,icon leader born slaveri
336,A cat with what fur pattern is almost always female?,1,52,11,1,cat fur pattern almost alway femal
339,Which nation does NOT have a two-word capital city?,1,51,10,1,nation capit citi
342,"In 2014, an excavation at a New Mexican landfill uncovered what?",0,64,13,1,2014 excav new mexican landfil uncov
344,The athlete who has competed in the most Olympic games hails from which country?,1,80,15,1,athlet compet olymp game hail countri
347,Which of these fonts was NOT created by Microsoft?,0,50,10,1,font creat microsoft
350,"In the first known use of “mammoth” as an adjective, what item was it describing?",1,81,19,1,first known use mammoth adject item describ
353,Which of these countries has a lower gross domestic product than any U.S. state?,0,80,15,1,countri lower gross domest product state
356,"Which of these Olympians is most likely to perform a lutz, axel or toe loop jump?",0,81,18,1,olympian like perform lutz axel toe loop jump
359,From what country did the American colonies win their independence?,0,67,11,1,countri american coloni win independ
362,Which of these animals is NOT native to Australia?,1,50,10,1,anim nativ australia
365,Which congressman participated in the Selma to Montgomery marches of 1965?,0,74,12,1,congressman particip selma montgomeri march 1965
368,The Ark of the Covenant supposedly contains what religious artifact?,1,68,11,1,ark coven supposedli contain religi artifact
371,Which of these actors is incapable of making a fist with his left hand?,0,71,15,1,actor incap make fist left hand
374,Which of these is NOT a term used in Olympic curling?,0,53,12,1,term use olymp curl
377,The “Cha-Cha Slide” includes a dance move named after what cartoon character?,0,77,15,1,slide includ danc move name cartoon charact
380,Portuguese is an official language of which country?,1,52,9,1,portugues offici languag countri
383,"Among U.S. astronauts, what distinction does Sally Ride have?",1,61,11,1,among astronaut distinct salli ride
386,Which chemical compound would you NOT use to create red and blue fireworks?,1,75,14,1,chemic compound would use creat red blue firework
389,King Louis XIV’s Palace of Versailles contained over 150 pieces of furniture made entirely of what?,1,99,19,1,king loui xiv palac versail contain 150 piec furnitur made entir
392,Which of the following is NOT used to describe someone from that particular state?,1,82,15,1,follow use describ someon particular state
395,Lonnie Johnson accidentally created the Supersoaker while trying to build what?,1,79,12,1,lonni johnson accident creat supersoak tri build
398,"In gardening, what word refers to overall health and usability of soil?",0,71,14,1,garden word refer overal health usabl soil
401,Which type of musical composition is also an Olympic figure skating jump?,0,73,13,1,type music composit also olymp figur skate jump
404,Low-income college students may qualify for a federal grant program named for a senator from what state?,0,104,18,1,colleg student may qualifi feder grant program name senat state
405,The westernmost region of Russia touches which of these countries?,1,66,11,1,westernmost region russia touch countri
408,Which animals race at the Kentucky Derby?,1,41,8,1,anim race kentucki derbi
411,What is the name for anger experienced while driving a car?,0,59,12,1,name anger experienc drive car
414,Which of these products is a depilatory?,1,40,8,1,product depilatori
417,Which of these songs was NOT recorded by the Beach Boys?,0,56,12,1,song record beach boy
420,Auguste Rodin's statue The Thinker is meant to represent what real-life person?,1,79,14,1,august rodin statu thinker meant repres person
423,Which of these is an alveolar disorder?,1,39,8,1,alveolar disord
426,Which of these two-letter combos is an acceptable word in Scrabble?,0,67,12,1,combo accept word scrabbl
429,Which of these Adam Sandler movies has a female director?,1,57,11,1,adam sandler movi femal director
432,Which position was first held in the last year of the previous century?,0,71,14,1,posit first held last year previou centuri
435,Which author's Pulitzer Prize-winning novel was adapted into a Broadway musical?,0,80,13,1,author pulitz novel adapt broadway music
438,The first edition of the CNN show Crossfire featured which host?,0,64,12,1,first edit cnn show crossfir featur host
441,"According to the Book of Leviticus, which of these animals is kosher to eat?",0,76,16,1,accord book leviticu anim kosher eat
444,Bart's age on “The Simpsons” is NOT the same as which of these characters?,0,74,18,1,bart age simpson charact
447,What beauty product entrepreneur became the first U.S. self-made female millionaire?,0,84,12,1,beauti product entrepreneur becam first femal millionair
449,The author who created Tarzan once worked for which of these publications?,0,74,13,1,author creat tarzan work public
452,What is the mid-day meal usually called?,0,40,8,1,meal usual call
455,In what part of a newspaper would you post an item for sale?,0,60,14,1,part newspap would post item sale
458,The “skyhook” is a move in which of these sports?,0,49,13,1,skyhook move sport
461,What U.S. state borders only one other U.S. state?,0,50,10,1,state border one state
464,The author of “The Picture of Dorian Gray” was born in what country?,0,68,16,1,author pictur dorian gray born countri
467,What is the name of London's electronic public transit pass?,0,60,12,1,name london electron public transit pass
470,"According to Marie Kondo, you should only own material items with what quality?",0,79,15,1,accord mari kondo materi item qualiti
473,Which of these North American deserts is the smallest?,0,54,10,1,north american desert smallest
476,Which Secretary-General of the United Nations once appeared on “Da Ali G Show”?,0,79,16,1,unit nation appear da ali g show
479,"One thousand years ago, which of these regions was heavily populated with Moorish people?",0,89,16,1,one thousand year ago region heavili popul moorish peopl
482,The first official African-American fraternity was founded at what university?,0,78,11,1,first offici fratern found univers
485,Which of these things did Skee-Lo NOT wish for in his hit '90s song?,0,68,15,1,thing wish hit song
488,Who famously painted the ceiling of the Sistine Chapel?,1,55,10,1,famous paint ceil sistin chapel
491,Which U.S. coin features a portrait of Abraham Lincoln?,0,55,10,1,coin featur portrait abraham lincoln
494,Which of these is NOT a unit of temperature?,0,44,10,1,unit temperatur
497,The R.E.M. song “Man on the Moon” was written about what comedian?,0,66,16,2,song man moon written comedian
500,What disease gets its name from the Italian term for “bad air”?,0,63,15,1,diseas get name italian term bad air
503,Students of Auguste Escoffier would have known how to do what?,0,62,12,1,student august escoffi would known
506,A 1976 book by Richard Dawkins introduced what now-common word?,0,63,11,1,1976 book richard dawkin introduc word
509,Which voice actor from “The Emperor’s New Groove” was once blacklisted in Hollywood?,1,84,18,1,voic actor emperor new groov blacklist hollywood
512,Which of these is NOT a menu option for ordering hash browns at Waffle House?,0,77,16,1,menu option order hash brown waffl hous
515,"What math concept is traditionally notated by a tall, S-shaped curve?",0,69,13,1,math concept tradit notat tall curv
518,Which of these supposedly hip cities does NOT have an Instagram filter named after it?,0,86,16,1,supposedli hip citi instagram filter name
521,The inventor of the board game Risk also directed what award-winning film?,0,74,13,1,inventor board game risk also direct film
524,"According to legend, what vessel is most likely to contain a wish-granting genie?",0,81,15,1,accord legend vessel like contain geni
527,Which of these destinations is legally allowed to bill itself as “The Happiest Place on Earth”?,0,95,19,1,destin legal allow bill happiest place earth
530,"At New Orleans Mardi Gras, what are float riders required to wear by law?",0,73,16,1,new orlean mardi gra float rider requir wear law
533,Which of these is NOT part of the three-word Olympic motto?,1,59,12,1,part olymp motto
536,Cirque du Soleil is a theater troupe first formed in which country?,0,67,13,1,cirqu du soleil theater troup first form countri
539,Which of these films does NOT prominently feature identical twins?,0,66,11,1,film promin featur ident twin
542,The painting “Washington Crosses the Delaware” has appeared on which state quarter?,1,83,15,1,paint washington cross delawar appear state quarter
545,The 2008 Olympics were the first time the medals contained what material?,1,73,13,1,2008 olymp first time medal contain materi
548,"When written in all caps, which insult refers to a common type of computer user interface?",0,90,18,1,written cap insult refer common type comput user interfac
551,What writer was the first to receive a MacArthur “genius” grant for science fiction?,1,84,17,1,writer first receiv macarthur geniu grant scienc fiction
553,The “Father of Art Deco” designed over 200 covers for which magazine?,0,69,15,1,father art deco design 200 cover magazin
556,"Who is Robert Downey, Jr.’s father?",1,35,10,1,robert downey father
559,"In July of 2017, Joey Chestnut set a world record by consuming 72 what?",0,71,16,1,juli 2017 joey chestnut set world record consum 72
562,Who just became the youngest woman to win gold in Olympics snowboarding?,0,72,13,1,becam youngest woman win gold olymp snowboard
565,"In Ancient Greece, Olympic athletes typically competed wearing what?",0,68,11,1,ancient greec olymp athlet typic compet wear
568,"What pop star first recorded under the same name as the so-called ""sailor's devil""?",0,83,18,1,pop star first record name sailor devil
571,"In the King James Bible, which of these measures “six cubits and a span”?",0,73,18,1,king jame bibl measur six cubit span
574,Which of these is NOT a palindrome?,0,35,8,1,palindrom
577,Aaron Sorkin &amp; Quentin Tarantino helped write the screenplay to which movie?,1,80,15,1,aaron sorkin amp quentin tarantino help write screenplay movi
580,"In 1997, Alabama’s state bar association put up a monument to whom?",1,67,16,1,1997 alabama state bar associ put monument
583,What Canadian city aptly takes its name from a Cree term for “muddy water”?,1,75,17,1,canadian citi aptli take name cree term muddi water
586,Which of these performers was part of the first Lollapalooza festival lineup?,0,77,13,1,perform part first lollapalooza festiv lineup
589,Hamburgers are usually made with what?,0,38,7,1,hamburg usual made
592,Who is the reigning monarch of Great Britain?,1,45,9,1,reign monarch great britain
595,Which of these is a tool used for glass blowing?,0,48,11,1,tool use glass blow
598,Which of these animals has a species named after Ferdinand Magellan?,1,68,12,1,anim speci name ferdinand magellan
601,"Ron Perlman, Kris Kristofferson and Lynda Carter have all recorded voices for what video game series?",1,101,18,1,ron perlman kri kristofferson lynda carter record voic video game seri
602,Ancient Egyptians shaved their eyebrows when what occurred?,0,59,9,1,ancient egyptian shave eyebrow occur
605,Which legendary writer used to live with Marlon Brando?,0,55,10,1,legendari writer use live marlon brando
608,Which of these animals does NOT possess chromatophores?,0,55,9,1,anim possess chromatophor
611,The intro of TV’s “Wide World of Sports” pairs the phrase “agony of defeat” with what footage?,0,94,24,1,intro tv wide world sport pair phrase agoni defeat footag
612,How did Senator Strom Thurmond prepare for the longest-ever U.S. Congressional filibuster?,0,90,13,1,senat strom thurmond prepar congression filibust
613,Which of these U.S. TV shows airs earliest in the day?,0,54,12,1,tv show air earliest day
616,Neil Armstrong was the first person to do what?,0,47,10,1,neil armstrong first person
